### ISSUE TITLE
Configuring ESLint to Correctly Lint

### ISSUE THREAD

**Issue by TheProdigyLeague** [eslint/eslintrc#189]
#188 

# The User Manual is not beginner friendly.

## There's a known issue when configuring ESLint for JavaScript linting across websites. Specifically, when configuring `.eslintrc` in development environments:

```rb
SHELL=/bin/bash
QT_ACCESSIBILITY=1
GTK_IM_MODULE=cros
TERMINAL_EMULATOR=JetBrains-JediTerm
XDG_CONFIG_HOME=/home/qenmity/.config
TERM_SESSION_ID=5919e236-1bb9-401d-b9f6-2c32c37a467e
XCURSOR_SIZE=24
DISPLAY_LOW_DENSITY=:1
PWD=/home/qenmity/AndroidStudioProjects/mockAdvertising
LOGNAME=qenmity
QT_QPA_PLATFORMTHEME=gtk2
XDG_SESSION_TYPE=wayland
SYSTEMD_EXEC_PID=326
WAYLAND_DISPLAY_LOW_DENSITY=wayland-1
XCURSOR_SIZE_LOW_DENSITY=12
SOMMELIER_VERSION=0.20
HOME=/home/qenmity
LANG=en_US.UTF-8
XDG_CURRENT_DESKTOP=X-Generic
WAYLAND_DISPLAY=wayland-0
INVOCATION_ID=bbf69710fd844dad8b914e6a567318c3
MANAGERPID=209
TERM=xterm-256color
USER=qenmity
NCURSES_NO_UTF8_ACS=1
DISPLAY=:0
SHLVL=1
XDG_RUNTIME_DIR=/run/user/1000
QT_AUTO_SCREEN_SCALE_FACTOR=1
JOURNAL_STREAM=7:3690
XCURSOR_THEME=Adwaita
XDG_DATA_DIRS=/home/qenmity/.local/share:/home/qenmity/.local/share/flatpak/exports/share:/var/lib/flatpak/exports/share:/usr/local/share:/usr/share
BROWSER=/usr/bin/garcon-url-handler
PATH=/usr/local/sbin:/usr/local/bin:/usr/local/games:/usr/sbin:/usr/bin:/usr/games:/sbin:/bin:/usr/bin
DBUS_SESSION_BUS_ADDRESS=unix:path=/run/user/1000/bus
LD_ARGV0_REL=../bin/garcon
SOMMELIER_VM_IDENTIFIER=85bcd451-bc84-4c78-bda1-f6712015385e
_=/usr/bin/printenv

```

```rb
SHELL=/bin/bash
USE_CLOUD_SDK_PYTHON3=
TMUX=/tmp/tmux-1000/default,483,0
GOOGLE_CLOUD_SHELL=true
HISTSIZE=1000
GOOGLE_CLOUD_PROJECT=arris-403819
JAVA_HOME=/usr/lib/jvm/java-17-openjdk-amd64
CLOUD_SHELL=true
GOOGLE_CLOUD_QUOTA_PROJECT=arris-403819
DEVSHELL_PROJECT_ID=arris-403819
DOTNET_SKIP_FIRST_TIME_EXPERIENCE=1
ASPNETCORE_URLS=http://*:8080
EVENT_NOEPOLL=1
PWD=/home/qenmity
LOGNAME=qenmity
DEVSHELL_CLIENTS_DIR=/var/run/google/devshell
WEB_HOST=cs-542741498729-default.cs-us-east1-pkhd.cloudshell.dev
HOME=/home/qenmity
LANG=en_US.UTF-8
LS_COLORS=rs=0:di=01;34:ln=01;36:mh=00:pi=40;33:so=01;35:do=01;35:bd=40;33;01:cd=40;33;01:or=40;31;01:mi=00:su=37;41:sg=30;43:ca=00:tw=30;42:ow=34;42:st=37;44:ex=01;32:*.tar=01;31:*.tgz=01;31:*.arc=01;31:*.arj=01;31:*.taz=01;31:*.lha=01;31:*.lz4=01;31:*.lzh=01;31:*.lzma=01;31:*.tlz=01;31:*.txz=01;31:*.tzo=01;31:*.t7z=01;31:*.zip=01;31:*.z=01;31:*.dz=01;31:*.gz=01;31:*.lrz=01;31:*.lz=01;31:*.lzo=01;31:*.xz=01;31:*.zst=01;31:*.tzst=01;31:*.bz2=01;31:*.bz=01;31:*.tbz=01;31:*.tbz2=01;31:*.tz=01;31:*.deb=01;31:*.rpm=01;31:*.jar=01;31:*.war=01;31:*.ear=01;31:*.sar=01;31:*.rar=01;31:*.alz=01;31:*.ace=01;31:*.zoo=01;31:*.cpio=01;31:*.7z=01;31:*.rz=01;31:*.cab=01;31:*.wim=01;31:*.swm=01;31:*.dwm=01;31:*.esd=01;31:*.avif=01;35:*.jpg=01;35:*.jpeg=01;35:*.mjpg=01;35:*.mjpeg=01;35:*.gif=01;35:*.bmp=01;35:*.pbm=01;35:*.pgm=01;35:*.ppm=01;35:*.tga=01;35:*.xbm=01;35:*.xpm=01;35:*.tif=01;35:*.tiff=01;35:*.png=01;35:*.svg=01;35:*.svgz=01;35:*.mng=01;35:*.pcx=01;35:*.mov=01;35:*.mpg=01;35:*.mpeg=01;35:*.m2v=01;35:*.mkv=01;35:*.webm=01;35:*.webp=01;35:*.ogm=01;35:*.mp4=01;35:*.m4v=01;35:*.mp4v=01;35:*.vob=01;35:*.qt=01;35:*.nuv=01;35:*.wmv=01;35:*.asf=01;35:*.rm=01;35:*.rmvb=01;35:*.flc=01;35:*.avi=01;35:*.fli=01;35:*.flv=01;35:*.gl=01;35:*.dl=01;35:*.xcf=01;35:*.xwd=01;35:*.yuv=01;35:*.cgm=01;35:*.emf=01;35:*.ogv=01;35:*.ogx=01;35:*.aac=00;36:*.au=00;36:*.flac=00;36:*.m4a=00;36:*.mid=00;36:*.midi=00;36:*.mka=00;36:*.mp3=00;36:*.mpc=00;36:*.ogg=00;36:*.ra=00;36:*.wav=00;36:*.oga=00;36:*.opus=00;36:*.spx=00;36:*.xspf=00;36:*~=00;90:*#=00;90:*.bak=00;90:*.crdownload=00;90:*.dpkg-dist=00;90:*.dpkg-new=00;90:*.dpkg-old=00;90:*.dpkg-tmp=00;90:*.old=00;90:*.orig=00;90:*.part=00;90:*.rej=00;90:*.rpmnew=00;90:*.rpmorig=00;90:*.rpmsave=00;90:*.swp=00;90:*.tmp=00;90:*.ucf-dist=00;90:*.ucf-new=00;90:*.ucf-old=00;90:
CLOUDSDK_CONFIG=/tmp/tmp.rTnkMVg12c
MINIKUBE_FORCE_SYSTEMD=true
DEVSHELL_SERVER_URL=https://ssh.cloud.google.com
PROMPT_COMMAND=history -a;update_devshell_project_id &> /dev/null
SSH_CONNECTION=127.0.0.1 51904 127.0.0.1 22
DOTNET_BUNDLE_EXTRACT_BASE_DIR=/home/qenmity/.cache/dotnet_bundle_extract
CUSTOM_ENVIRONMENT=
GEM_PATH=/home/qenmity/.gems:/usr/local/lib/ruby/gems/3.2.0/
GEM_HOME=/home/qenmity/.gems
LESSCLOSE=/usr/bin/lesspipe %s %s
CLOUDSHELL_OPEN_DIR=cloudshell_open
TERM=screen
CLOUDSDK_DIAGNOSTICS_HIDDEN_PROPERTY_ALLOWLIST=compute/gce_metadata_read_timeout_sec
LESSOPEN=| /usr/bin/lesspipe %s
USER=qenmity
TMUX_PANE=%0
CLOUD_SHELL_IMAGE_VERSION=
GCE_METADATA_HOST=169.254.169.254
BASHRC_PATH=/home/qenmity/.bashrc
CLOUDSDK_DIAGNOSTICS_HIDDEN_PROPERTY_WHITELIST=compute/gce_metadata_read_timeout_sec
SHLVL=3
TRUSTED_ENVIRONMENT=true
__TMP_CLOUDSDK_CONFIG=/tmp/tmp.rTnkMVg12c
CLOUDSHELL_ENVIRONMENT=prod
USER_EMAIL=qenmity@gmail.com
ACTIVE_CUSTOM_IMAGE=
BASHRC_GOOGLE_PATH=/google/devshell/bashrc.google
PS1=\[\e]0;${DEVSHELL_PROJECT_ID:-Cloud Shell}\a\]\u@cloudshell:\[\033[1;34m\]\w$([[ -n $DEVSHELL_PROJECT_ID ]] && printf " \[\033[1;33m\](%s)" ${DEVSHELL_PROJECT_ID} )\[\033[00m\]$ \[\033k$([[ -n $DEVSHELL_PROJECT_ID ]] && printf "(%s)" ${DEVSHELL_PROJECT_ID} || printf "cloudshell")\033\\\]
SSH_CLIENT=127.0.0.1 51904 22
MINIKUBE_HOME=/google/minikube
DEBUGINFOD_URLS=https://debuginfod.ubuntu.com 
DOCKER_HOST=unix:///var/run/docker.sock
DEVSHELL_IP_ADDRESS=
V2V_GCP_V2V_IMAGE=projects/v2v-community/global/images/family/v2v-stable
BROWSER=echo
PATH=/home/qenmity/.local/bin:/opt/gradle/bin:/opt/maven/bin:/usr/local/sbin:/usr/local/bin:/usr/sbin:/usr/bin:/sbin:/bin:/usr/local/go/bin:/usr/local/node_packages/node_modules/.bin:/usr/local/rvm/bin:/home/qenmity/.gems/bin:/usr/local/rvm/bin:/home/qenmity/gopath/bin:/google/gopath/bin:/google/flutter/bin:/usr/local/nvm/versions/node/v22.17.1/bin
HISTFILESIZE=1000
SSH_TTY=/dev/pts/1
DEVSHELL_GCLOUD_CONFIG=cloudshell-32572
USE_GKE_GCLOUD_AUTH_PLUGIN=True
API_DOGFOOD=
GOPATH=/home/qenmity/gopath:/google/gopath
MINIKUBE_WANTUPDATENOTIFICATION=false
CREDENTIALS_SERVICE_PORT=8998
_=/usr/bin/printenv
```

** Linting can produce thousands of these `no-undef`, `no-unused-vars` errors. **

For example,

```js
...
-undef
  2:1959220  error  '$' is not defined                                                                         no-undef
  2:1959260  error  '$' is not defined                                                                         no-undef
  2:1959306  error  '$' is not defined                                                                         no-undef
  2:1959340  error  'html_encode' is not defined                                                               no-undef
  2:1959369  error  '$' is not defined                                                                         no-undef
  2:1959412  error  '$' is not defined                                                                         no-undef
  2:1959446  error  'i18n' is not defined                                                                      no-undef
  2:1959484  error  '$' is not defined                                                                         no-undef
  2:1959524  error  '$' is not defined                                                                         no-undef
  2:1959591  error  '$' is not defined                                                                         no-undef
  2:1959787  error  't' is defined but never used                                                              no-unused-vars
...
```

### It is not that my `config` file is not 'configured properly' that is the root issue.

Here's the thing: a "misconfigured" `.eslint` file will debug as usual. When I audit the same files I've linted, it produces results as expected.

The main issue I've noticed is when developers lazily use algorithmic programming of global variables, like `$` for `jQuery`, `il8n` for declarations, and `html_encode` for configuration files in `.eslintrc`.

#### DevTools needs to be updated to declare these known globals in their respective `webpack`, `devkit`, `rootkit`, and `webkit` root API folders. 

The linter is suggesting that we remove or ignore certain variables like `t`, `e`, etc., which could be a configuration issue in `.eslintrc`. Fixing this could improve the codebase's linting quality.

However, cross-referencing these issues after linting reveals CPU-related and `.NET`-related errors. While it may not seem directly related, when developers constantly declare variables in their API, users can experience CPU and network issues due to large heaping before performance overhauls.

For example,

```js
####################



# Request:



####################



GET / HTTP/1.1



Host: 23.227.38.65



User-Agent: Mozilla/5.0 (Windows NT 10.0; Win64; x64) AppleWebKit/537.36 (KHTML, like Gecko) Chrome/131.0.0.0 Safari/537.36 Edg/131.0.2903.86





####################



# Response:



####################



HTTP/1.1 403 Forbidden



Date: Wed, 25 Jun 2025 01:13:02 GMT



Content-Type: text/plain; charset=UTF-8



Content-Length: 16



Connection: close



X-Frame-Options: SAMEORIGIN



Referrer-Policy: same-origin



Cache-Control: private, max-age=0, no-store, no-cache, must-revalidate, post-check=0, pre-check=0



Expires: Thu, 01 Jan 1970 00:00:01 GMT



Server: cloudflare



CF-RAY: 955099a17b3d341d-MIA



error code: 1003



[+] 23.227.38.65:80 cloudflare ( 403-Forbidden )



[*] Scanned 1 of 1 hosts (100% complete)



[*] Auxiliary module execution completed



GET / HTTP/2

Host: puter.com

Accept-Language: en-US,en;q=0.9

Upgrade-Insecure-Requests: 1

User-Agent: Mozilla/5.0 (X11; Linux x86_64) AppleWebKit/537.36 (KHTML, like Gecko) Chrome/138.0.0.0 Safari/537.36

Accept: text/html,application/xhtml+xml,application/xml;q=0.9,image/avif,image/webp,image/apng,*/

*;q=0.8,application/signed-exchange;v=b3;q=0.7

Sec-Ch-Ua: "Not)A;Brand";v="8", "Chromium";v="138"

Sec-Ch-Ua-Mobile: ?0

Sec-Ch-Ua-Platform: "Linux"

Sec-Fetch-Site: none

Sec-Fetch-Mode: navigate

Sec-Fetch-User: ?1

Sec-Fetch-Dest: document

Accept-Encoding: gzip, deflate, br

Priority: u=0, i

Connection: keep-alive

```

# The problem with bloat code

As you can see in the DevTools performance/security audit heaps via proxy, my network analysis reveals similar information (Even though it may not directly be related to static code analysis).

```rb
92543 484.581976717 23.227.38.65 100.115.92.202 TCP 78 443 → 41182 [ACK] Seq=25512 Ack=807 Win=131072 Len=0 TSval=1535287367 TSecr=2048160787 SLE=806 SRE=807

92542 484.581974884 23.227.38.65 100.115.92.202 TCP 78 [TCP Dup ACK 92486#1] 443 → 41182 [ACK] Seq=25512 Ack=782 Win=131072 Len=0 TSval=1535287367 TSecr=2048160779 SLE=806 SRE=807

92529 484.555654264 23.227.38.65 100.115.92.202 TCP 66 [TCP Dup ACK 92528#1] 8443 → 43496 [ACK] Seq=1 Ack=518 Win=131072 Len=0 TSval=3794923513 TSecr=2048160757

92528 484.555427169 23.227.38.65 100.115.92.202 TCP 66 8443 → 43496 [ACK] Seq=1 Ack=518 Win=131072 Len=0 TSval=3794923513 TSecr=2048160757

92527 484.551678149 100.115.92.202 23.227.38.65 TCP 66 41182 → 443 [ACK] Seq=782 Ack=25512 Win=43136 Len=0 TSval=2048160779 TSecr=1535287280

92523 484.529073841 23.227.38.65 100.115.92.202 TCP 74 8443 → 43496 [SYN, ACK] Seq=0 Ack=1 Win=65535 Len=0 MSS=1460 SACK_PERM TSval=3794923486 TSecr=2048160738 WS=8192

92522 484.527706353 23.227.38.65 100.115.92.202 TCP 78 [TCP Dup ACK 92502#1] 8443 → 43494 [ACK] Seq=8474 Ack=784 Win=131072 Len=0 TSval=930196968 TSecr=2048160664 SLE=808 SRE=809

92460 484.312337271 23.227.38.65 100.115.92.202 TCP 74 443 → 41182 [SYN, ACK] Seq=0 Ack=1 Win=65535 Len=0 MSS=1460 SACK_PERM TSval=1535287096 TSecr=2048160517 WS=8192

92459 484.311932372 23.227.38.65 100.115.92.202 TCP 78 443 → 41166 [ACK] Seq=25577 Ack=801 Win=131072 Len=0 TSval=2635933163 TSecr=2048160516 SLE=800 SRE=801

92458 484.311930281 23.227.38.65 100.115.92.202 TCP 78 [TCP Dup ACK 92415#1] 443 → 41166 [ACK] Seq=25577 Ack=776 Win=131072 Len=0 TSval=2635933163 TSecr=2048160515 SLE=800 SRE=801

92457 484.289800644 100.115.92.202 23.227.38.65 TCP 66 43480 → 8443 [ACK] Seq=783 Ack=8481 Win=56064 Len=0 TSval=2048160517 TSecr=1623024372

92456 484.289739823 100.115.92.202 23.227.38.65 TCP 74 41182 → 443 [SYN] Seq=0 Win=64240 Len=0 MSS=1460 SACK_PERM TSval=2048160517 TSecr=0 WS=128
```

**Comment by fasttime** [comment]
Hi @TheProdigyLeague! It's not clear what problem you are describing. Can you please fill in [this template](https://github.com/eslint/eslint/issues/new?template=bug-report.yml) to report your issue? Thanks!
